"","id","titulo","descricao","publicadoEm","data","hora","aoVivo","idCanal","nomeCanal","visualizacoes","curtidas","descurtidas","favoritos","comentarios","categoryId","defaultAudioLanguage","categoria","faturamento"
"275","q8tOHCdB5Fk","PULCINO PIO - El Pollito Pio superstar (Official video)","iTunes: https://itunes.apple.com/it/album/el-pollito-pio-y-sus-amigos/id639579588 Spotify: http://open.spotify.com/album/5zOOuP1CliykFZ8xvbx10U Facebook: ...",2014-12-17 10:42:13,2014-12-17,38520,"none","UCW4w39HG16HSuDkvLu4AIaA","PULCINO PIO",69789847,111418,45909,0,4438,10,NA,"Música",69000
"276","5dFGtHaFYoI","BIG MONEY ILLUMINATI - OFFICIAL VIDEO SONG (ilvostrocarodexter)","Ringrazio Snitecs per la canzone: https://www.youtube.com/user/iffsnitecs <U+2606> Pagina Facebook ...",2015-10-07 12:30:00,2015-10-07,45000,"none","UCNo7m7faHS9t3nSDfWXvGww","ilvostrocaroDexter",5971222,205771,10510,0,18629,20,NA,"Jogos",5000
"277","GY9Ymm7gZ84","PROVA A NON RIDERE!! (SFIDA IMPOSSIBILE)  #challengeinlove","5'000 Mi Piace?? Suggeriteci le CHALLENGE da fare per i prossimi episodi di #challengeinlove -- Pagina Facebook ...",2014-05-20 12:30:01,2014-05-20,45000,"none","UCNo7m7faHS9t3nSDfWXvGww","ilvostrocaroDexter",4968951,96677,10071,0,3952,23,NA,"Comédia",4000
"278","i6KwLSHwozw","UN VIDEO DIVERTENTE! (Speciale 700.000 Iscritti) ilvostrocaroDexter","Pagina Facebook <U+25BB> https://www.facebook.com/pages/IlvostrocaroDexter/475635372453883 <U+2606> Giochi scontatissimi <U+25BB> http://goo.gl/hdyLb4 - Instagram ...",2015-05-24 12:14:34,2015-05-24,44040,"none","UCNo7m7faHS9t3nSDfWXvGww","ilvostrocaroDexter",4471855,83075,941,0,1795,20,NA,"Jogos",4000
"279","B3InYyINF_k","Le 5 cose da NON FARE mai su GTA 5","Seguimi su Facebook <U+25BB> https://www.facebook.com/pages/IlvostrocaroDexter/475635372453883 Video sullo stile dei 5 gicatori pi<f9> odiati in sono sicur<f2> vi ...",2013-10-18 16:00:06,2013-10-18,57600,"none","UCNo7m7faHS9t3nSDfWXvGww","ilvostrocaroDexter",4320502,79945,5275,0,2213,20,NA,"Jogos",4000
"280","s8LTfQg1jC4","CROSSBAR CHALLENGE EPICA!!!","Pagina Facebook <U+25BB> https://www.facebook.com/pages/IlvostrocaroDexter/475635372453883 <U+2606> Giochi scontatissimi ...",2015-08-19 10:30:00,2015-08-19,37800,"none","UCNo7m7faHS9t3nSDfWXvGww","ilvostrocaroDexter",4101053,256274,2365,0,8289,20,NA,"Jogos",4000
"281","B7jg9SgpxOI","MATES - FIGO (WIGGLE PARODIA)","Ringraziamenti Testi: Luca Virno Snitecs: https://www.youtube.com/user/iffsnitecs Comparse nel Video: SabriGamer: https://www.youtube.com/user/lasabrigamer ...",2016-09-02 09:00:01,2016-09-02,32400,"none","UCHZl_sLl4kGZSkrPBrWb_aQ","Anima",9138086,328053,17121,0,14561,10,"it","Música",9000
"282","uzCJHtBWrhU","SLIP AND SLIDE FOOTBALL CHALLENGE! MATES & FAVIJ [CALCIO SAPONATO]","E' tornata la sfida sul campo da calcio! Troppo divertente! Shop e i miei Social: http://www.thatsanima.com/ I miei desideri su Amazon: http://amzn.to/1RaMul4 ...",2016-08-20 09:30:01,2016-08-20,34200,"none","UCHZl_sLl4kGZSkrPBrWb_aQ","Anima",4380600,265122,3003,0,5200,24,"it","Entretenimento",4000
"283","lEuaASWQKKU","FAQ CON UNA MODELLA! (Suicidegirl)","Pagina Violet: https://www.facebook.com/violetmodel Instagram Violet: https://www.instagram.com/violetsg_/ (violetsg_) Giochi digitali a prezzi stracciati: ...",2015-05-06 11:30:00,2015-05-06,41400,"none","UCHZl_sLl4kGZSkrPBrWb_aQ","Anima",3441799,192464,1994,0,3727,24,NA,"Entretenimento",3000
"284","clkmO_fvDyM","CHALLENGE OBBLIGO O VERITA' [LA PIU' BELLA DI SEMPRE!]","Cosa avremo dovuto subire questa volta? scopritelo... Shop e i miei Social: http://www.thatsanima.com/ I miei desideri su Amazon: http://amzn.to/1RaMul4 ...",2016-04-07 12:32:43,2016-04-07,45120,"none","UCHZl_sLl4kGZSkrPBrWb_aQ","Anima",3249742,227407,3031,0,4768,24,"it","Entretenimento",3000
"285","hC-HFt3jqtc","VI PRESENTO LA MIA FIDANZATA!!","Finalmente vi mostro la mia ragazza! Godetevi il video Shop e i miei Social: http://www.thatsanima.com/ I miei desideri su Amazon: http://amzn.to/1RaMul4 ...",2016-07-28 12:00:01,2016-07-28,43200,"none","UCHZl_sLl4kGZSkrPBrWb_aQ","Anima",3232726,242888,9403,0,32101,24,"it","Entretenimento",3000
"286","noY6ggSNTF0","Gabry Ponte - Che ne sanno i 2000 feat. Danti (Official Video)","Gabry Ponte - Che ne sanno i 2000 feat. Danti #CheNeSannoi2000 <e8> su: Spotify <U+279F> http://spoti.fi/2adkJfM iTunes <U+279F> http://apple.co/29DR2Vr Apple Music ...",2016-07-26 10:00:02,2016-07-26,36000,"none","UC9PZVgJF-mX4aDDzLE4z5Zg","Warner Music Italy",57305189,457008,50972,0,36365,10,NA,"Música",57000
"287","jKlYf1oArQg","Laura Pausini - V<ed>veme (Official Video)","2009 WMG Laura Pausini - V<ed>veme Spotify: https://open.spotify.com/artist/2e4nwiX8ZCU09LGLOpeqTH iTunes: https://itun.es/it/kFxd.",2010-11-11 18:20:02,2010-11-11,66000,"none","UC9PZVgJF-mX4aDDzLE4z5Zg","Warner Music Italy",43688173,146122,5619,0,4129,10,NA,"Música",43000
"288","AmqhjOMT1Gc","Laura Pausini - Quiero Decirte Que Te Amo (Official Video)","2009 WMG Laura Pausini - Quiero Decirte Que Te Amo Spotify: https://open.spotify.com/artist/2e4nwiX8ZCU09LGLOpeqTH iTunes: https://itun.es/it/kFxd.",2010-11-11 18:07:14,2010-11-11,65220,"none","UC9PZVgJF-mX4aDDzLE4z5Zg","Warner Music Italy",42675767,136375,5255,0,4491,10,NA,"Música",42000
"289","izttIKfEzr8","Benji & Fede - Tutto per una Ragione feat. Annalisa (Official Video)","Benji & Fede - Tutto per una Ragione feat. Annalisa https://lnk.to/BenjieFedeZeroPositivo Attrice: Yahmina Kesner Attore: Juan Pedro Checa Noguera Director: ...",2017-05-16 12:30:02,2017-05-16,45000,"none","UC9PZVgJF-mX4aDDzLE4z5Zg","Warner Music Italy",39373496,236224,16218,0,7827,10,NA,"Música",39000
"290","DAIxrSvq6bo","Nek - Laura no est<e0> (Official Video)","2010 WMG Nek - Laura no est<e0> Spotify: https://open.spotify.com/artist/5mXMQJHLLfym1KyNcDrhoZ iTunes: https://itun.es/it/06HB.",2010-12-15 12:37:09,2010-12-15,45420,"none","UC9PZVgJF-mX4aDDzLE4z5Zg","Warner Music Italy",33926425,129545,4838,0,9542,10,NA,"Música",33000
"291","xDCVhMTPHvY","CENTRA IL CESTINO CHALLENGE - CALCIO CON I MATES E I2BOMBER","Iscriviti: http://bit.ly/JoinSurreal I2Bomber: https://www.youtube.com/user/i2bomber MAGLIETTE: http://bit.ly/matesitalia <U+25BB>Pagina Facebook: ...",2016-01-02 12:00:02,2016-01-02,43200,"none","UC3V8twsHOUBGvM_xsQ_4ZJg","SurreaIPower",1743808,97330,722,0,1210,20,"it","Jogos",1000
"292","GY10dwodBT4","CHE FIGATA IL BUNGEE JUMPING","Iscriviti: http://bit.ly/JoinSurreal | Giochi a prezzo scontato: http://www.instant-gaming.com/it/igr702862/ MAGLIETTE: http://bit.ly/matesitalia <U+25BB>Pagina Facebook: ...",2015-08-10 11:00:01,2015-08-10,39600,"none","UC3V8twsHOUBGvM_xsQ_4ZJg","SurreaIPower",1684761,75744,1107,0,1362,20,"it","Jogos",1000
"293","Xmixs1bMxsI","MINIGAMES CON IL TRIO (TRIPLA WEBCAM)","Iscriviti: http://bit.ly/JoinSurreal MAGLIETTE: http://bit.ly/matesitalia <U+25BB>Pagina Facebook: https://www.facebook.com/SurrealPower <U+25CB> Twitter/Instagram ...",2015-11-17 13:30:00,2015-11-17,48600,"none","UC3V8twsHOUBGvM_xsQ_4ZJg","SurreaIPower",1539226,69163,824,0,826,20,"it","Jogos",1000
"294","VbVeCaSm7TM","HAPPY WHEELS CON FAVIJ","Ordina il libro su Amazon:http://amzn.to/2dShE96 | MAGLIETTE: http://bit.ly/matesitalia <U+25BB>Pagina Facebook: https://www.facebook.com/SurrealPower ...",2016-11-20 10:00:04,2016-11-20,36000,"none","UC3V8twsHOUBGvM_xsQ_4ZJg","SurreaIPower",1513585,52202,633,0,1073,20,"it","Jogos",1000
"295","k9SqJXyM3-k","Minecraft ITA - #530 - NUOVO MONDO, INIZIO COL BOTTO","Iscriviti: http://bit.ly/JoinSurreal MAGLIETTE: http://bit.ly/matesitalia <U+25BB>Pagina Facebook: https://www.facebook.com/SurrealPower <U+25CB> Twitter/Instagram ...",2016-03-07 13:00:01,2016-03-07,46800,"none","UC3V8twsHOUBGvM_xsQ_4ZJg","SurreaIPower",1437775,81321,621,0,3928,24,"it","Entretenimento",1000
"296","TQhk2K-vaWk","TERRIFICANTE...Ladro Tenta di Entrare in casa mentre Registro Moto gp 15 (non <e8> uno scherzo)","Ragazzi sono su Instagram: https://instagram.com/cicciogamer_89 Key di Gioco ad un Ottimo Prezzo : http://www.instant-gaming.com/igr/CiccioGamer89/ Ecco ...",2015-07-31 17:00:01,2015-07-31,61200,"none","UC1jTVZboWRPpjGKAN921M5w","CiccioGamer89",4956042,171382,7650,0,9748,20,"zxx","Jogos",4000
"297","EXy83qr9jrI","il Pi<f9> Grande Chest's Opening ITALIANO!!! 104.514 GEMME! sulle nuove Leggendarie!","Seguimi su Instagram: https://instagram.com/cicciogamer_89 Key di Gioco ad un Ottimo Prezzo : http://www.instant-gaming.com/igr/CiccioGamer89/ Ecco la mia ...",2016-05-03 12:00:00,2016-05-03,43200,"none","UC1jTVZboWRPpjGKAN921M5w","CiccioGamer89",4708781,299268,13285,0,11956,20,"it","Jogos",4000
"298","muSrWALYUO4","La leggenda di Herobrine e la sua Tomba Perduta ! Full HD","Leggimi importante Premessa,questa <e8> una storia che mi <e8> stata raccontata,che io credo sia veritiera,le cose che ho descritto in questo video le ho cercate x il ...",2012-09-05 00:26:11,2012-09-05,1560,"none","UC1jTVZboWRPpjGKAN921M5w","CiccioGamer89",2299271,84135,4033,0,6800,20,NA,"Jogos",2000
"299","-CN4rTCGACg","In Cucina con Ciccio: l'hamburger Laido e Corrotto!","Ragazzi sono su Instagram: https://instagram.com/cicciogamer_89 Key di Gioco ad un Ottimo Prezzo : http://www.instant-gaming.com/igr/CiccioGamer89/ Ecco ...",2015-12-14 13:00:01,2015-12-14,46800,"none","UC1jTVZboWRPpjGKAN921M5w","CiccioGamer89",1635120,76741,2042,0,3898,24,"it","Entretenimento",1000
"300","8z4B_vtpj_M","Trailer Canale di CiccioGamer89 .","Iscriviti al mio canale :-) Key di Gioco ad un Ottimo Prezzo : https://www.instant-gaming.com/it/?igr=CiccioGamer89 Hakuna matata ragazzi/e,un trailer DOC .",2014-04-14 12:00:04,2014-04-14,43200,"none","UC1jTVZboWRPpjGKAN921M5w","CiccioGamer89",1556818,13657,354,0,591,20,NA,"Jogos",1000
"301","tWs1E2BfNZE","QUAL <c9> A SENHA DO WIFI - Par<f3>dia Adele - Hello","MEU INSTAGRAM: http://goo.gl/uYVFV2 MEU TWITTER: http://goo.gl/z6Wwdj MINHA P<c1>GINA: http://goo.gl/vuB0a1 MEU FACE: http://goo.gl/q2QSUj CANAIS ...",2015-12-05 23:00:00,2015-12-05,82800,"none","UC3KQ5GWANYF8lChqjZpXsQw","whinderssonnunes",58583168,2869439,52603,0,144979,23,NA,"Comédia",58000
"302","WhGnY2hTVF0","CRIAN<c7>A DE RICO E CRIAN<c7>A DE POBRE","INGRESSOS: http://www.whindersson.com.br MEU INSTAGRAM: http://goo.gl/uYVFV2 MEU TWITTER: http://goo.gl/z6Wwdj MINHA P<c1>GINA: ...",2016-06-09 22:46:51,2016-06-09,81960,"none","UC3KQ5GWANYF8lChqjZpXsQw","whinderssonnunes",40179872,3739928,34793,0,82813,23,NA,"Comédia",40000
"303","UmmXiN93btM","EU CANSEI DE SER POBRE | Par<f3>dia Ed Sheeran - Shape of You [Official Video]","MEU INSTAGRAM: @whinderssonnunes MEU TWITTER: @whindersson MINHA P<c1>GINA: http://goo.gl/vuB0a1 MEU FACE: http://goo.gl/q2QSUj.",2017-04-09 00:00:01,2017-04-09,0,"none","UC3KQ5GWANYF8lChqjZpXsQw","whinderssonnunes",31678655,1923124,32533,0,61196,23,NA,"Comédia",31000
"304","7l8VjJKOsiU","NA SUA CARA | PAR<d3>DIA Major Lazer - Sua Cara (feat. Anitta & Pabllo Vittar) (Official Music Video)","AGENDA: http://www.whindersson.com.br XAFURDARIA: https://www.youtube.com/user/xafurdariaoficial PUTZV<c9>I: ...",2017-08-02 23:00:30,2017-08-02,82800,"none","UC3KQ5GWANYF8lChqjZpXsQw","whinderssonnunes",30300700,2746992,41998,0,96762,23,NA,"Comédia",30000
"305","eYfFDaPdkWc","WHINDERSSON NUNES em MARMININO (SHOW COMPLETO)","Assistiu? Deixa seu like (: MEU INSTAGRAM: @whinderssonnunes MEU TWITTER: @whindersson MINHA P<c1>GINA: http://goo.gl/vuB0a1 MEU FACE: ...",2016-12-21 23:00:01,2016-12-21,82800,"none","UC3KQ5GWANYF8lChqjZpXsQw","whinderssonnunes",30165670,1503730,17454,0,60766,23,"pt","Comédia",30000
"306","_P7S2lKif-A","MC Fioti - Bum Bum Tam Tam (KondZilla)","Inscreva-se no Canal da KondZilla e assista os clipes antes de todo mundo. https://goo.gl/HXfRT5 Escute a playlist do KondZilla no Spotify: ...",2017-03-08 22:00:01,2017-03-08,79200,"none","UCffDXn7ycAzwL2LDlbyWOTw","Canal KondZilla",314116132,2270191,155254,0,80555,10,NA,"Música",314000
"307","lYxcW8jtFw0","MC G15 - Deu Onda (KondZilla)","Inscreva-se no Canal da KondZilla e assista os clipes antes de todo mundo. https://goo.gl/HXfRT5 Escute a playlist do KondZilla no Spotify: ...",2016-12-21 20:00:02,2016-12-21,72000,"none","UCffDXn7ycAzwL2LDlbyWOTw","Canal KondZilla",309760412,2025269,334994,0,149270,10,NA,"Música",309000
"308","3yd_eoMOvqk","MC Kevinho - Olha a Explos<e3>o (KondZilla)","Inscreva-se no Canal da KondZilla e assista os clipes antes de todo mundo. https://goo.gl/HXfRT5 Escute a playlist do KondZilla no Spotify: ...",2016-12-26 21:00:00,2016-12-26,75600,"none","UCffDXn7ycAzwL2LDlbyWOTw","Canal KondZilla",289909718,2501936,154560,0,119438,10,NA,"Música",289000
"309","-PH4S7IPQxU","MC Kevinho - O Grave Bater (KondZilla)","Inscreva-se no Canal da KondZilla e assista os clipes antes de todo mundo. https://goo.gl/HXfRT5 Siga o KondZilla no INSTAGRAM e confira os bastidores dos ...",2017-03-21 22:00:01,2017-03-21,79200,"none","UCffDXn7ycAzwL2LDlbyWOTw","Canal KondZilla",266223148,2514511,154100,0,117072,10,NA,"Música",266000
"310","EWcOY14GWwM","MCs Zaac & Jerry - Bumbum Granada (KondZilla)","Inscreva-se no Canal da KondZilla e assista os clipes antes de todo mundo. https://goo.gl/HXfRT5 Acompanhe os bastidores dos videoclipes no Snapchat: ...",2016-05-02 22:00:01,2016-05-02,79200,"none","UCffDXn7ycAzwL2LDlbyWOTw","Canal KondZilla",257351800,1984797,208104,0,180189,10,NA,"Música",257000
"311","ISFaJenCMow","RETROSPECTIVA DE FAVELA 2015 #RewindBr","J<e1> que no BR ningu<e9>m faz, a gente se re<fa>ne e improvisa! CLIQUE EM GOSTEI, FAVORITE, COMENTE E SE INSCREVA! Mauricio Cid ...",2015-12-26 16:59:54,2015-12-26,61140,"none","UCPHXtOVmjvbP9OJihsd7gCg","CanalCanalha",22200122,1676396,14682,0,119478,23,NA,"Comédia",22000
"312","3tR2BxCnncI","AS INADEQUADAS G<cd>RIAS","CLIQUE EM GOSTEI, FAVORITE, COMENTE E SE INSCREVA! CANAL DO GABRIEL: https://www.youtube.com/user/MrCRITICALGAMES ...",2016-01-23 16:27:42,2016-01-23,59220,"none","UCPHXtOVmjvbP9OJihsd7gCg","CanalCanalha",20043228,1699990,16635,0,55093,23,NA,"Comédia",20000
"313","Yh9AlMpelJI","O BAR ME AMA <U+266A> PAR<d3>DIA - DEU ONDA","CLIQUE EM GOSTEI, FAVORITE, COMENTE E SE INSCREVA! LOJINHA BACANA - https://www.canalcanalha.com.br https://instagram.com/cocielo ...",2017-02-04 21:33:38,2017-02-04,77580,"none","UCPHXtOVmjvbP9OJihsd7gCg","CanalCanalha",17422445,1244551,17612,0,32843,23,NA,"Comédia",17000
"314","91-JgCfIEjI","MC ROZI - BEBO PRA FICAR RUIM (JULIO COCIELO)","CLIQUE EM GOSTEI, SE INSCREVA E ENVIA PRA GERAL! LOJINHA BACANA - https://www.canalcanalha.com.br https://instagram.com/cocielo ...",2016-12-15 22:05:15,2016-12-15,79500,"none","UCPHXtOVmjvbP9OJihsd7gCg","CanalCanalha",16771711,1034804,16688,0,41246,23,NA,"Comédia",16000
"315","PMK8kbNeNxs","TRAVESS<c3>O MASTERS","Batalha de sabores Fanta! Acesse http://FantaURL.com/Julio e vote no seu sabor preferido #FantaVsFanta CLIQUE EM GOSTEI, FAVORITE, COMENTE E SE ...",2015-06-10 20:53:21,2015-06-10,75180,"none","UCPHXtOVmjvbP9OJihsd7gCg","CanalCanalha",15487920,797298,5054,0,15116,23,NA,"Comédia",15000
"316","2Lp7XO6oWCM","N<e3>o Faz Sentido! - Crep<fa>sculo","Siga-me no Twitter: http://www.twitter.com/felipeneto Conhe<e7>a e compre na loja: http://www.felipeneto.net Veja meu segundo canal (VLOG): ...",2010-07-05 20:25:32,2010-07-05,73500,"none","UCV306eHqgo0LvBf3Mh36AHg","Felipe Neto",15370684,0,0,0,53933,24,NA,"Entretenimento",15000
"317","OYFaQ4U6dzo","CURTIDINHA - Par<f3>dia PARADINHA / Anitta","Essa produ<e7><e3>o foi criada pela Take4 Content Letra - Willian Vitale, Felipe Neto e Anitta M<fa>sica - UmMusic (Umberto Tavares) Agradecimento especial - Leo ...",2017-06-09 14:32:52,2017-06-09,52320,"none","UCV306eHqgo0LvBf3Mh36AHg","Felipe Neto",11908669,1178818,23797,0,66922,24,"pt","Entretenimento",11000
"318","dkAgtOVvErg","DESAFIO TENTE N<c3>O RIR - PAREM DE TORTURAR BEB<ca>S!","N<c3>O ESQUE<c7>A DE SE INSCREVER*** Inscreva-se aqui: http://bit.ly/1f2kX84 Snap: felipenetoreal Insta: felipenetoreal Twitter: felipeneto.",2016-11-29 12:00:01,2016-11-29,43200,"none","UCV306eHqgo0LvBf3Mh36AHg","Felipe Neto",11231109,752232,28332,0,43221,24,"pt","Entretenimento",11000
"319","CrbboUuAkVo","DESAFIO - TENTE N<c3>O RIR!","Recomendo esse canal: http://bit.ly/2ge8tRJ ***N<c3>O ESQUE<c7>A DE SE INSCREVER*** Inscreva-se aqui: http://bit.ly/1f2kX84 ** Vamos ajudar? Clique abaixo: ...",2016-10-07 13:00:00,2016-10-07,46800,"none","UCV306eHqgo0LvBf3Mh36AHg","Felipe Neto",10922648,523451,19330,0,61307,24,"pt","Entretenimento",10000
"320","Mc2rL5dezCo","DESAFIO TENTE N<c3>O RIR - MAS QUE POR&@ <c9> ESSA?","N<c3>O ESQUE<c7>A DE SE INSCREVER*** Inscreva-se aqui: http://bit.ly/1f2kX84 Assista LAS VEGAS REAL: http://bit.ly/2itJ6rN Conhe<e7>a a KABUM: ...",2017-01-09 12:00:02,2017-01-09,43200,"none","UCV306eHqgo0LvBf3Mh36AHg","Felipe Neto",10051906,757165,20287,0,31877,24,"pt","Entretenimento",10000
"321","h1A9Kc5iNkQ","ROLA","Fil<e9> com queijo, pizza, coxinha, pastel, empada, ""kibe"", esfiha, dois hamb<fa>rgueres, alface, queijo, molho especial, cebola, picles, p<e3>o com gergelim, a<e7>a<ed>, ...",2013-01-10 12:55:58,2013-01-10,46500,"none","UCEWHPFNilsT0IfQfutVzsag","Porta dos Fundos",26608144,217282,17229,0,11140,24,"pt","Entretenimento",26000
"322","4WryP4KxHaU","ESSA <c9> PRA VOC<ca>","Chico Buarque escreveu ""C<e1>lice"" alfinetando a ditadura. Os censores do governo n<e3>o perceberam. Latino criticou ""Renata Ingrata, quem planta sacanagem ...",2013-03-07 14:00:33,2013-03-07,50400,"none","UCEWHPFNilsT0IfQfutVzsag","Porta dos Fundos",24753616,403762,6349,0,14361,24,"pt","Entretenimento",24000
"323","NZb0XKHgtjo","NA LATA","Pra Coca, quanto mais Maradona melhor. Pra Fanta, quanto mais David Brazil melhor. Pra Caninha, quanto mais Lula melhor. Pra latinha, que <e9> bom, ningu<e9>m ...",2013-01-17 12:59:12,2013-01-17,46740,"none","UCEWHPFNilsT0IfQfutVzsag","Porta dos Fundos",23422951,252279,4569,0,10788,24,"pt","Entretenimento",23000
"324","6EYmKAs7mzc","SOBRE A MESA","Dizem que uma rela<e7><e3>o saud<e1>vel entre um homem e uma mulher <e9> baseada na sinceridade, mas certas verdades n<e3>o podem ser simplesmente jogadas sobre ...",2012-09-10 13:59:06,2012-09-10,50340,"none","UCEWHPFNilsT0IfQfutVzsag","Porta dos Fundos",22197472,259677,10614,0,10452,24,"pt","Entretenimento",22000
"325","-nb2Tu8rAHg","CASAMENTO","O casamento. Para os noivos, o dia mais importante de uma vida. Para a fam<ed>lia, o in<ed>cio de um novo ciclo. Para os padrinhos, o dia seguinte da despedida de ...",2013-03-04 13:57:41,2013-03-04,50220,"none","UCEWHPFNilsT0IfQfutVzsag","Porta dos Fundos",20274157,256649,4299,0,11108,24,"pt","Entretenimento",20000
"326","OeWxxTLdRBw","Rap Minecraft Para<ed>so | Ft TAUZ (Minecraft Animation)","Se Inscreva no canal: http://goo.gl/X35Pv7 <U+2713> Tauz: https://goo.gl/z9N3kv <U+2713> DOWNLOAD: https://goo.gl/c4rpti <U+2713> PLAYLIST: http://goo.gl/TSC5tn LIVE AGORA: ...",2015-07-11 17:00:00,2015-07-11,61200,"none","UCbTVTephX30ZhQF5zwFppBg","rezendeevil",21076906,492972,10603,0,48874,20,NA,"Jogos",21000
"327","ZmBYXZZcKgA","ISOLADOS - O FILME - PT 1","Se Inscreva no canal: http://goo.gl/X35Pv7 <U+2713> Camisetas RezendeEvil: http://goo.gl/fxHzyc <U+2713> PLAYLIST: <U+2713> Pr<f3>ximo Epis<f3>dio: Em Breve <U+2713> Epis<f3>dio Anterior: ...",2015-07-10 17:00:01,2015-07-10,61200,"none","UCbTVTephX30ZhQF5zwFppBg","rezendeevil",16325443,349032,17203,0,27154,20,NA,"Jogos",16000
"328","T9IIVOGg0s0","MINECRAFT vs POKEMON GO : GIGA PIKACHU VS REZENDE !!!","INGRESSOS TEATRO: http://nonstopproducoes.com.br/rezende/ <U+2713> Se Inscreva no canal: http://goo.gl/X35Pv7 <U+2713> ULTIMA JOGADA: https://goo.gl/0GZSU4 <U+2713> DE ...",2016-10-22 14:00:10,2016-10-22,50400,"none","UCbTVTephX30ZhQF5zwFppBg","rezendeevil",13306002,75425,7793,0,8704,20,NA,"Jogos",13000
"329","ebd9bc8FPX4","MUSICA ISOLADOS - #ESPECIAL","Se Inscreva no canal: http://goo.gl/X35Pv7 <U+2713> Canal da BIBI: https://www.youtube.com/watch?v=aEk3zK2aMCs <U+2713> Canal do Gagui: ...",2015-06-12 17:00:01,2015-06-12,61200,"none","UCbTVTephX30ZhQF5zwFppBg","rezendeevil",12649801,618390,75290,0,79804,20,NA,"Jogos",12000
"330","Y-fPhd9sVqw","MINECRAFT vs POKEMON GO : GIGA CHARIZARD VS REZENDE!!","INGRESSOS TEATRO: http://nonstopproducoes.com.br/rezende/ <U+2713> Se Inscreva no canal: http://goo.gl/X35Pv7 <U+2713> ULTIMA JOGADA: https://goo.gl/0GZSU4 <U+2713> DE ...",2016-09-20 21:02:09,2016-09-20,75720,"none","UCbTVTephX30ZhQF5zwFppBg","rezendeevil",11696080,73230,7274,0,6018,20,NA,"Jogos",11000
"331","9h1l5Z0mH0w","Minecraft M<fa>sica <U+266B> - COM MEUS AMIGOS | Animation Minecraft (Feat. Brancoala)","Outras Anima<e7><f5>es: http://bit.ly/VideosCanal Camisas Canal: http://bit.ly/CamisasCanal <U+25CB> Clique em (mostrar mais) Assista outras Series do Canal: <U+25CB> Perdidos: ...",2015-08-11 15:00:05,2015-08-11,54000,"none","UCIPA6iWNaoetaa1T46RkzXw","AuthenticGames",33528839,625017,13010,0,57150,20,NA,"Jogos",33000
"332","lB93IKPgFCk","A Vida de Um Creeper Minecraft Anima<e7><e3>o // The Life of a Creeper Minecraft Animation","Outras Anima<e7><f5>es Aqui : http://bit.ly/OutrosVideos Pescaria Anima<e7><e3>o - http://youtu.be/PK9YlaszkNM A Grande Disputa : http://bit.ly/1oulvCg Anima<e7><e3>o ...",2014-10-15 19:29:51,2014-10-15,70140,"none","UCIPA6iWNaoetaa1T46RkzXw","AuthenticGames",16767804,94279,8453,0,4805,20,NA,"Jogos",16000
"333","xkQxkI3L0AE","Minecraft: Fabrica dos MINIONS !! - Aventuras Com Mods #11","Mais Aventuras com mods: http://bit.ly/1QMVe0m Camisas Canal: http://bit.ly/CamisasCanal <U+25CB> Clique em (mostrar mais) Mods Usados Aqui: http://bit.ly/OhHp0l ...",2015-06-29 15:09:48,2015-06-29,54540,"none","UCIPA6iWNaoetaa1T46RkzXw","AuthenticGames",13022351,152582,4809,0,4417,20,NA,"Jogos",13000
"334","jDARX4yUPkk","<U+266B> RAP ESPECIAL DE 5 MILH<d5>ES DE INSCRITOS !! (feat.7Minutoz)","7 Minutoz : https://www.youtube.com/user/7minutoz Livro Authentic: http://bit.ly/LivroDoAuthentic Facebook - http://www.facebook.com/7minutoz Twitter (Lucas) ...",2016-05-21 13:00:02,2016-05-21,46800,"none","UCIPA6iWNaoetaa1T46RkzXw","AuthenticGames",11520327,657165,6927,0,133446,20,NA,"Jogos",11000
"335","Od8csGYy8AQ","Minecraft : TUBAR<c3>O NA PRAIA !! - Aventuras Com Mods #40","Mais Aventuras com mods: http://bit.ly/1QMVe0m Camisas Canal: http://bit.ly/CamisasCanal <U+25CB> Clique em (mostrar mais) Mods Usados Aqui: http://bit.ly/OhHp0l ...",2015-11-12 15:00:00,2015-11-12,54000,"none","UCIPA6iWNaoetaa1T46RkzXw","AuthenticGames",10810252,148130,4068,0,5122,20,NA,"Jogos",10000
"336","63WnVWala1k","5inco Minutos - ""BANG""  (PAR<d3>DIA) <U+266B>","LETRA: Miga sua louca voc<ea> pare de falar de mim! Eu n<e3>o gosto desse tipo de gentinha assim! An an! An an an! An an! An an an! An an! An an an! Bem! Bem!",2015-11-24 13:51:41,2015-11-24,49860,"none","UC3RpTX6fEMJ6KBNTTgXJB9w","5incominutos",44577097,1449635,136932,0,136994,24,NA,"Entretenimento",44000
"337","DLbDdOkdBaY","<U+266B>  DEZ PRAS CINCO - Par<f3>dia DESPACITO / Luis Fonsi ft. Justin Bieber","LETRA: J<e1> coloquei o meu pijama, O plano era t<e1> na cama, <e9> Mas fui jogar Playstation e agora pra parar? Ouou, n<e3>o d<e1>! Todo mundo eu j<e1> stalkiei, Quero ver ...",2017-05-10 22:22:34,2017-05-10,80520,"none","UC3RpTX6fEMJ6KBNTTgXJB9w","5incominutos",20847607,1038532,33081,0,38922,24,NA,"Entretenimento",20000
"338","xL-53F_cOYs","5inco Minutos - O QUE AS MULHERES PENSAM ENQUANTO SE MAQUIAM","Sabe o que se passa na cabe<e7>a de uma garota enquanto ela se maquia? Se voc<ea> <e9> homem, esse v<ed>deo vai te ensinar a entender melhor as mulheres, se voc<ea> ...",2015-06-30 17:26:36,2015-06-30,62760,"none","UC3RpTX6fEMJ6KBNTTgXJB9w","5incominutos",11350356,667917,12997,0,40610,24,NA,"Entretenimento",11000
"339","29j6TKzo4yc","5inco Minutos - MINHA PRIMEIRA VEZ","Pra voc<ea> que j<e1> perdeu a Virgindade esse v<ed>deo pode parecer um pouco teen, mas n<e3>o <e9>! Aqui eu falei o porque eu n<e3>o acredito que existe uma idade certa ...",2015-05-05 13:02:42,2015-05-05,46920,"none","UC3RpTX6fEMJ6KBNTTgXJB9w","5incominutos",9405789,504268,19692,0,21132,24,NA,"Entretenimento",9000
"340","I1ABxialb3U","5inco Minutos - COM QUANTOS HOMENS J<c1> TRANSEI?","Kefera.",2013-03-22 21:45:33,2013-03-22,78300,"none","UC3RpTX6fEMJ6KBNTTgXJB9w","5incominutos",9069648,292088,18974,0,17695,24,NA,"Entretenimento",9000
"341","_R84uhlE2fc","PEDINDO MC DONALDS CANTANDO Ft Cocielo e Gusta","Voc<ea> j<e1> tentou fazer um pedido no Drive Thru do McDonalds CANTANDO? N<e3>o? N<f3>s sim! Veja nesse v<ed>deo especial que conta com a participa<e7><e3>o especial de ...",2015-02-09 13:30:00,2015-02-09,48600,"none","UCH2VZQBLFTOp6I_qgnBJCuQ","Canal Nostalgia",16418227,1082532,5197,0,18640,24,"pt","Entretenimento",16000
"342","iu_GRdKGtcw","Retrospectiva 2015 <U+266B> | Canal Nostalgia","Est<e1> no ar a retrospectiva 2015 do canal Nostalgia. Compartilhe e deixe o seu gostei para dar aquela for<e7>a S2 Meu Twitter - http://goo.gl/A1AsOg @fecastanhari ...",2015-12-31 19:30:00,2015-12-31,70200,"none","UCH2VZQBLFTOp6I_qgnBJCuQ","Canal Nostalgia",12363133,768851,14791,0,40492,24,"pt","Entretenimento",12000
"343","BDMebvnnJLc","IMITANDO YOUTUBERS Ft Whindersson e Mr Poladoful","Mais um Castanhari Indica para voc<ea>s! Dessa vez eu trago Whindersson Nunes e Mr Poladoful para me ajudar a IMITAR youtubers como o Japa TV, Julio ...",2015-08-31 14:00:01,2015-08-31,50400,"none","UCH2VZQBLFTOp6I_qgnBJCuQ","Canal Nostalgia",9942089,730289,6586,0,19401,24,"pt","Entretenimento",9000
"344","7sNQ4PCng0I","ODIEI CRESCER <U+266B> Par<f3>dia Tiago Iorc - Amei Te Ver - Ft Kefera e Christian","Uma par<f3>dia da famosa m<fa>sica Amei Te Ver do Tiago Iorc, que mostra como foi ruim crescer, a<ed>, que saudades da minha inf<e2>ncia! Compartilhe no Facebook ...",2016-12-16 14:00:00,2016-12-16,50400,"none","UCH2VZQBLFTOp6I_qgnBJCuQ","Canal Nostalgia",9577724,620461,16430,0,25288,24,"pt","Entretenimento",9000
