"","id","titulo","descricao","publicadoEm","data","hora","aoVivo","idCanal","nomeCanal","visualizacoes","curtidas","descurtidas","favoritos","comentarios","categoryId","defaultAudioLanguage","categoria","faturamento"
"1","_GuOjXYl5ew","YouTube Rewind: The Ultimate 2016 Challenge | #YouTubeRewind","YouTube Rewind 2016. Celebrating the videos, people, music and moves that made 2016. #YouTubeRewind Spend more time with your favorite creators, ...",2016-12-07 18:00:03,2016-12-07,64800,"none","UCBR8-60-B28hp2BmDPdntcQ","YouTube Spotlight",200076804,3097566,488281,0,677755,25,"en","Notícias e Política",2e+05
"2","iCkYw3cRwLo","Rewind YouTube Style 2012","WATCH THE 2014 VIDEO: http://yt.be/rewind We invited some YouTubers to star in a mash-up of culturally defining moments of 2012. Can you spot all the ...",2012-12-18 04:53:05,2012-12-18,17580,"none","UCBR8-60-B28hp2BmDPdntcQ","YouTube Spotlight",185295874,1196100,76056,0,212638,24,NA,"Entretenimento",185000
"3","KK9bwTlAvgo","YouTube Rewind: Now Watch Me 2015 | #YouTubeRewind","YouTube Rewind 2015. Celebrating the videos, people, music and moves that made 2015. #YouTubeRewind Watch the year's trending videos: ...",2015-12-09 18:00:42,2015-12-09,64800,"none","UCBR8-60-B28hp2BmDPdntcQ","YouTube Spotlight",127726235,2383365,178274,0,445516,24,"en","Entretenimento",127000
"4","H7jtC8vjXw8","YouTube Rewind: What Does 2013 Say?","To celebrate 2013, we invited some YouTubers to star in a mashup of popular moments this year. Can you spot all the references? WATCH THE TOP VIDEOS ...",2013-12-11 08:00:01,2013-12-11,28800,"none","UCBR8-60-B28hp2BmDPdntcQ","YouTube Spotlight",123454932,1243256,67158,0,169486,24,"en","Entretenimento",123000
"5","zKx2B8WCQuw","YouTube Rewind: Turn Down for 2014","YouTube Rewind 2014. Celebrating the moments, memes, and people that made 2014. #YouTubeRewind WATCH 2014'S TOP VIDS: http://yt.be/rewind ...",2014-12-09 17:57:35,2014-12-09,64620,"none","UCBR8-60-B28hp2BmDPdntcQ","YouTube Spotlight",120372625,1337080,67659,0,183602,24,"en","Entretenimento",120000
"6","0KSOMA3QBU0","Katy Perry - Dark Horse (Official) ft. Juicy J","Get ""Dark Horse"" from Katy Perry's 'PRISM': http://katy.to/PRISM WITNESS: The Tour tickets available now! https://www.katyperry.com/tour Directed by Matthew ...",2014-02-20 20:00:03,2014-02-20,72000,"none","UC-8Q-hLdECwQmaWNwXitYDw","KatyPerryVEVO",2126370507,6255046,820668,0,496615,10,NA,"Música",2126000
"7","QGJuMBdaqIw","Katy Perry - Firework (Official)","Get <U+0093>Firework<U+0094> from Katy Perry's 'Teenage Dream': http://katy.to/TeenageDream WITNESS: The Tour tickets available now! https://www.katyperry.com/tour ...",2010-10-28 19:37:50,2010-10-28,70620,"none","UC-8Q-hLdECwQmaWNwXitYDw","KatyPerryVEVO",1050659055,3195222,182843,0,424191,10,NA,"Música",1050000
"8","KlyXNRrsk4A","Katy Perry - Last Friday Night (T.G.I.F.) (Official)","You're invited to the party of the year! Find out what happened to Kathy Beth Terry in the official music video for Katy Perry's <U+0093>Last Friday Night (T.G.I.F.)<U+0094> featuring ...",2011-06-12 23:00:00,2011-06-12,82800,"none","UC-8Q-hLdECwQmaWNwXitYDw","KatyPerryVEVO",1010537785,3113413,276751,0,352708,10,NA,"Música",1010000
"9","k0BWlvnBmIE","Katy Perry - Wide Awake (Official)","Get <U+0093>Wide Awake<U+0094> from Katy Perry's 'Teenage Dream: The Complete Confection': http://katy.to/TeenageDream WITNESS: The Tour tickets available now!",2012-06-18 23:53:07,2012-06-18,85980,"none","UC-8Q-hLdECwQmaWNwXitYDw","KatyPerryVEVO",774709414,2517633,146070,0,215469,10,NA,"Música",774000
"10","kTHNpusq654","Katy Perry - Hot N Cold (Official)","Get <U+0093>Thinking Of You<U+0094> from Katy Perry's 'One of the Boys'': http://katy.to/OneOfTheBoys WITNESS: The Tour tickets available now! https://www.katyperry.com/tour ...",2008-10-14 02:07:26,2008-10-14,7620,"none","UC-8Q-hLdECwQmaWNwXitYDw","KatyPerryVEVO",720790821,2110726,122148,0,119685,10,NA,"Música",720000
"11","QcIy9NiNbmo","Taylor Swift - Bad Blood ft. Kendrick Lamar","Check out Taylor's new video <U+0093>Bad Blood!<U+0094> <U+0093>Bad Blood<U+0094> featuring Kendrick Lamar is Available Now on iTunes http://smarturl.it/tsbadblood. Taylor's multi-platinum ...",2015-05-18 04:00:00,2015-05-18,14400,"none","UCANLZYMidaCbLQFWXBC95Jg","TaylorSwiftVEVO",1129433584,5396888,472258,0,441748,10,NA,"Música",1129000
"12","VuNIsY6JdUw","Taylor Swift - You Belong With Me","Music video by Taylor Swift performing You Belong With Me. (C) 2009 Big Machine Records, LLC #VEVOCertified on April 16, 2011.",2009-06-16 22:02:30,2009-06-16,79320,"none","UCANLZYMidaCbLQFWXBC95Jg","TaylorSwiftVEVO",764455877,3018011,129177,0,255324,10,NA,"Música",764000
"13","IdneKLhsWOQ","Taylor Swift - Wildest Dreams","Check out Taylor's new video <U+0093>Wildest Dreams<U+0094>. <U+0093>Wildest Dreams<U+0094> is Available Now on her multi-platinum release 1989 on iTunes or Google Play: ...",2015-08-31 00:55:00,2015-08-31,3300,"none","UCANLZYMidaCbLQFWXBC95Jg","TaylorSwiftVEVO",575814637,2926928,167152,0,200584,10,NA,"Música",575000
"14","3tmd-ClpJxA","Taylor Swift - Look What You Made Me Do","Pre-order Taylor Swift's new album, reputation, including <U+0093>Look What You Made Me Do,<U+0094> here: http://smarturl.it/reputationTS http://vevo.ly/MOlgkR.",2017-08-28 00:30:22,2017-08-28,1800,"none","UCANLZYMidaCbLQFWXBC95Jg","TaylorSwiftVEVO",512088952,5709739,998573,0,642066,10,"en","Música",512000
"15","-CmadmM5cOk","Taylor Swift - Style","Check out Taylor's new stunning video for <U+0093>Style"". Taylor's multi-platinum release 1989 is Available Now on iTunes http://www.smarturl.it/TS1989.",2015-02-13 13:20:01,2015-02-13,48000,"none","UCANLZYMidaCbLQFWXBC95Jg","TaylorSwiftVEVO",510578807,2212918,127801,0,116995,10,NA,"Música",510000
"16","uelHwf8o7_U","Eminem - Love The Way You Lie ft. Rihanna","Music video by Eminem performing Love The Way You Lie. <U+00A9> 2010 Aftermath Records #VEVOCertified on September 13, 2011. http://www.vevo.com/certified ...",2010-08-05 19:09:46,2010-08-05,68940,"none","UC20vb-R_px4CguHzzBPhoyQ","EminemVEVO",1402046933,5233395,201082,0,487376,10,"en-US","Música",1402000
"17","j5-yKhDd64s","Eminem - Not Afraid","Music video by Eminem performing Not Afraid. (C) 2010 Aftermath Records #VEVOCertified on September 11, 2010.http://www.vevo.com/certified ...",2010-06-05 05:02:39,2010-06-05,18120,"none","UC20vb-R_px4CguHzzBPhoyQ","EminemVEVO",1016790790,5302782,156702,0,790263,10,"en-US","Música",1016000
"18","1wYNFfgrXTI","Eminem - When I'm Gone","Music video by Eminem performing When I'm Gone. (C) 2005 Aftermath Entertainment/Interscope Records.",2009-06-17 00:23:36,2009-06-17,1380,"none","UC20vb-R_px4CguHzzBPhoyQ","EminemVEVO",574215954,2848831,81384,0,225048,10,"en-US","Música",574000
"19","XbGs_qK2PQA","Eminem - Rap God (Explicit)","Download Eminem's 'MMLP2' Album on iTunes now:http://smarturl.it/MMLP2 Credits below Video Director: Rich Lee Video Producer: Justin Diener Video ...",2013-11-27 16:50:00,2013-11-27,60600,"none","UC20vb-R_px4CguHzzBPhoyQ","EminemVEVO",565975089,5655363,215825,0,497462,10,"en-US","Música",565000
"20","EHkozMIXZ8w","Eminem - The Monster (Explicit) ft. Rihanna","Download Eminem's 'MMLP2' Album on iTunes now:http://smarturl.it/MMLP2 Music video by Eminem ft. Rihanna ""The Monster"" <U+00A9> 2013 Interscope.",2013-12-17 00:50:00,2013-12-17,3000,"none","UC20vb-R_px4CguHzzBPhoyQ","EminemVEVO",535518823,2742520,95478,0,123306,10,"en-US","Música",535000
"21","2uJE48aKVNo","Beef 'n Go","WATCH THIS EPISODE EN ESPA<d1>OL: http://youtu.be/uUN_7ToagOI OUR FACEBOOK: http://facebook.com/smosh Are you the kind of person that just loves ...",2008-05-03 18:20:32,2008-05-03,66000,"none","UCY30JRSgfhYXA6i6xX1erWg","Smosh",102595655,113444,25416,0,24237,43,NA,"Shows",102000
"22","12PWq22E9CQ","ULTIMATE ASSASSIN'S CREED 3 SONG [Music Video]","AC4 MUSIC VIDEO: http://youtu.be/WpMt2vzrIxs WATCH BLOOPERS & MORE: http://bit.ly/AC3XTRAS GET THE REMIX! http://smo.sh./iTunesSweetSound ...",2012-10-26 19:16:59,2012-10-26,69360,"none","UCY30JRSgfhYXA6i6xX1erWg","Smosh",84946631,959281,29030,0,171788,43,"en","Shows",84000
"23","mO1QBTG6EXs","THE LEGEND OF ZELDA RAP [MUSIC VIDEO]","WATCH BLOOPERS & MORE: http://bit.ly/ZELDAxtras DOWNLOAD THE SONG ON ITUNES: http://smo.sh/13NrBp8 DOWNLOAD UNCENSORED SONG: ...",2011-11-18 21:15:54,2011-11-18,76500,"none","UCY30JRSgfhYXA6i6xX1erWg","Smosh",70811754,781736,18867,0,176398,43,"en","Shows",70000
"24","e1h5TzdTq0o","POKEMON IN REAL LIFE!","MORE POKEMON VIDEOS: https://youtu.be/4BO2HgT2p4M?list=PL2C924BB1F9863B0A BLOOPERS & MORE: http://bit.ly/PokemonEXTRAS WATCH EN ...",2011-04-22 19:24:00,2011-04-22,69840,"none","UCY30JRSgfhYXA6i6xX1erWg","Smosh",53693960,397051,11706,0,40844,43,"en","Shows",53000
"25","LfoGBVM86PM","POKEMON IN REAL LIFE 2!","MORE POKEMON VIDEOS: https://youtu.be/4BO2HgT2p4M?list=PL2C924BB1F9863B0A WATCH THE BLOOPERS & MORE: http://bit.ly/Poke2Bloops WATCH ...",2011-06-17 19:30:32,2011-06-17,70200,"none","UCY30JRSgfhYXA6i6xX1erWg","Smosh",38894604,270627,5635,0,47892,43,NA,"Shows",38000
"26","UtsfUAHkyWQ","Ping Pong Trick Shots 2 | Dude Perfect","Ping Pong Trick Shots are back & they're BIGGER than ever! ---------------------------------------- <U+25BB> VISIT our NEW STORE! - http://dudeperfect.merchline.com <U+25BB>Click ...",2015-02-16 23:00:56,2015-02-16,82800,"none","UCRijo3ddMTht_IHyNSNXpNQ","Dude Perfect",118319569,1164671,34159,0,58912,17,NA,"Esportes",118000
"27","f9jhWFKV3u0","Nerf Blasters Edition | Dude Perfect","Trick Shots: Nerf style. ---------------------------------------- <U+25BB> GRAB our NERF TOYS! - https://www.amazon.com/shop/dudeperfect <U+25BB> VISIT our NEW STORE!",2013-08-05 13:26:29,2013-08-05,48360,"none","UCRijo3ddMTht_IHyNSNXpNQ","Dude Perfect",83931280,429696,17663,0,39710,17,NA,"Esportes",83000
"28","UeG1ftTmLAg","Ping Pong Trick Shots 3 | Dude Perfect","We take Ping Pong Trick Shots to the next level! Sponsored advertising by Oreo Cookies. Some of our biggest videos ever are coming out soon so stay tuned so ...",2017-04-03 21:57:27,2017-04-03,79020,"none","UCRijo3ddMTht_IHyNSNXpNQ","Dude Perfect",81754045,2848146,56150,0,422431,17,NA,"Esportes",81000
"29","CACAmH4r1fw","Bowling Trick Shots | Dude Perfect","Dude Perfect teams up w/ the World's #1 Bowler: Jason Belmonte ---------------------------------------- <U+25BB> VISIT our NEW STORE! - http://dudeperfect.merchline.com ...",2014-06-02 21:58:18,2014-06-02,79080,"none","UCRijo3ddMTht_IHyNSNXpNQ","Dude Perfect",72208128,464970,11074,0,43896,17,NA,"Esportes",72000
"30","P8V_bx0L4RY","Water Bottle Flip Edition | Dude Perfect","It's time to flip some water bottles! <U+25BB> VISIT our NEW STORE - http://bit.ly/DPStore <U+25BB> SUBSCRIBE for MORE! - http://bit.ly/SubscribeToDP Play our FREE new ...",2016-07-18 21:56:02,2016-07-18,78960,"none","UCRijo3ddMTht_IHyNSNXpNQ","Dude Perfect",67526822,1023081,25866,0,91006,17,NA,"Esportes",67000
"31","k3aAl92_VDE","Adam Levine's New Girlfriend","Three-year-old Mila is Adam's biggest (little) fan, and had quite the reaction when she found out he was married!",2015-10-16 13:00:02,2015-10-16,46800,"none","UCp0hYYBW6IMayGgR-WeoCvQ","TheEllenShow",65700389,425190,12215,0,0,24,"en","Entretenimento",65000
"32","QZmkU5Pg1sw","Surprise! Britney Learns 'Gangnam Style' from Psy!","Korean pop star and YouTube sensation Psy gave Britney Spears a surprise visit on the show, and taught her his famous horse dance!",2012-09-11 03:33:08,2012-09-11,12780,"none","UCp0hYYBW6IMayGgR-WeoCvQ","TheEllenShow",58841029,211899,13404,0,32739,24,NA,"Entretenimento",58000
"33","HYjHld318p0","The Perfect, Last-Minute Kids' Costumes!","Ellen's done it again! She's put together some terrific costumes for your kids this year.",2014-10-29 20:00:02,2014-10-29,72000,"none","UCp0hYYBW6IMayGgR-WeoCvQ","TheEllenShow",50512610,172213,16621,0,0,24,"en","Entretenimento",50000
"34","mavy9X6Cno4","Ellen's Astounding Anaconda Dancer","She's only 11 years old, but she can really bust a move! Ellen had a very talented young dancer and her choreographer perform on the show.",2014-10-01 21:00:03,2014-10-01,75600,"none","UCp0hYYBW6IMayGgR-WeoCvQ","TheEllenShow",48597339,324574,18973,0,0,24,"en","Entretenimento",48000
"35","Tmvk7kRC7VU","A Huge Surprise for Justin Bieber's Superfan!","An Ellen viewer, Paige, is a huge Justin Bieber fan, so Ellen set up a big surprise for Paige at her house -- Justin himself! Then Ellen had another surprise for her ...",2011-02-09 17:25:16,2011-02-09,62700,"none","UCp0hYYBW6IMayGgR-WeoCvQ","TheEllenShow",47537549,292925,12992,0,54472,24,NA,"Entretenimento",47000
"36","xfeys7Jfnx8","Nice Guys","Behind the Scenes at http://www.youtube.com/higatv Two losers take a ""how to pick up girls"" class and realize that Nice Guys finish last which results in the ...",2011-05-31 20:33:21,2011-05-31,73980,"none","UCSAUGyc_xA8uYzaIVG6MESQ","nigahiga",73723135,806832,11082,0,170358,24,NA,"Entretenimento",73000
"37","JdLCEwEFCMU","How to be Ninja","This is a dvd that shows you how to be an excellent ninja. Songs Used: Carl Douglas - Kung Fu Fighting Mortal Kombat Theme Song Pink Panther Theme Song ...",2007-07-26 03:26:37,2007-07-26,12360,"none","UCSAUGyc_xA8uYzaIVG6MESQ","nigahiga",49061512,569215,12606,0,99055,23,NA,"Comédia",49000
"38","khFhF64P3VQ","How to be Gangster","A dvd that teaches you how to be a true gangster Songs Used: Soulja Boy - Crank Dat Colbie Caillat - Bubbly Flo Rida - Low Rihanna - Unfaithful MIMS - This is ...",2007-11-05 03:26:26,2007-11-05,12360,"none","UCSAUGyc_xA8uYzaIVG6MESQ","nigahiga",45226029,366872,10796,0,61298,23,NA,"Comédia",45000
"39","AJVpL6L7Zeo","How To Sing Like Your Favorite Artists","Whether you think you can't sing, or if you know you can... you cant. YET! Check out my 2nd Channel for more vlogs: http://www.youtube.com/higatv Follow me ...",2013-05-30 07:21:55,2013-05-30,26460,"none","UCSAUGyc_xA8uYzaIVG6MESQ","nigahiga",44053036,1075224,9980,0,118899,23,NA,"Comédia",44000
"40","Phbe8mEDMe4","The ipod Human","The Apple ipod has taken over the modern day world. We created one even better.",2007-11-11 02:40:48,2007-11-11,9600,"none","UCSAUGyc_xA8uYzaIVG6MESQ","nigahiga",42506516,281885,9581,0,53479,23,NA,"Comédia",42000
"41","iOztnsBPrAA","WARNING: SCARIEST GAME IN YEARS | Five Nights at Freddy's - Part 1","No other game has given me a greater feeling of dread than this one. Five Nights at Freddy's is incredibly unique and takes an approach to horror that I've never ...",2014-08-12 18:23:51,2014-08-12,66180,"none","UC7_YxT-KID8kRbqZo7MyscQ","Markiplier",62333999,513124,25095,0,163728,20,NA,"Jogos",62000
"42","Zz8MCVJb0_k","Five Nights at Freddy's ANIMATED","Watch Five Nights at Freddy's in a whole new way! Watch the SECOND ANIMATION!",2014-09-28 22:03:59,2014-09-28,79380,"none","UC7_YxT-KID8kRbqZo7MyscQ","Markiplier",55531758,397224,8010,0,19052,20,NA,"Jogos",55000
"43","60wLvPWXCCc","SCARIEST GAME EVER MADE | Five Nights at Freddy's 2 - Part 1","Five Nights at Freddy's 2 is HERE and it's SO MUCH SCARIER than before! More FNAF ...",2014-11-10 23:04:31,2014-11-10,83040,"none","UC7_YxT-KID8kRbqZo7MyscQ","Markiplier",35652032,348564,11600,0,99789,20,NA,"Jogos",35000
"44","ndsaoMFz9J4","MEOW","Cats don't go nyan, they go MEOW! WOOF <U+25BB> https://youtu.be/MujRLvZ61jE Behold the result of 8 hours of wasted time in an effort to make the stupidest video I ...",2015-10-15 01:29:45,2015-10-15,5340,"none","UC7_YxT-KID8kRbqZo7MyscQ","Markiplier",35100103,913702,10918,0,85848,15,NA,"Animais de estimação e Animais",35000
"45","JlwCE7UHi88","Markiplier Animated | YANDERE SIMULATOR","Yandere Simulator has been animated by GrittySugar! MORE Animations <U+25BB> http://bitly.com/MarkiplierAnimated Made By <U+25BB> http://bitly.com/GrittySugar Yandere ...",2015-08-21 15:02:36,2015-08-21,54120,"none","UC7_YxT-KID8kRbqZo7MyscQ","Markiplier",32377706,406454,6890,0,34189,20,NA,"Jogos",32000
"46","SXiSVQZLje8","Ariana Grande - Side To Side ft. Nicki Minaj","Side To Side ft. Nicki Minaj (Official Video) Taken from the new album Dangerous Woman Download Now! http://republicrec.co/AriDangerousWoman Listen on ...",2016-08-30 03:00:00,2016-08-30,10800,"none","UC0VOyT2OCBKdQhF3BAbZ-1g","ArianaGrandeVevo",1136428990,5623761,379692,0,413051,10,NA,"Música",1136000
"47","iS1g8G_njx8","Ariana Grande - Problem ft. Iggy Azalea","Buy now! http://smarturl.it/ArianaMyEvrythnDlxiT?IQid=vevo.cta.problem Google Play: http://goo.gl/n7rey5 Pre-order My Everything and get access to the ...",2014-05-30 20:00:01,2014-05-30,72000,"none","UC0VOyT2OCBKdQhF3BAbZ-1g","ArianaGrandeVevo",1056003480,4156232,274698,0,265536,10,NA,"Música",1056000
"48","L8eRzOYhLuw","Ariana Grande - Break Free ft. Zedd","Ariana Grande ""My Everything<U+0094> available for download now http://smarturl.it/ArianaMyEvrythnDlxiT.",2014-08-13 00:55:01,2014-08-13,3300,"none","UC0VOyT2OCBKdQhF3BAbZ-1g","ArianaGrandeVevo",895664909,3513416,277949,0,277961,10,NA,"Música",895000
"49","lf_wVfwpfp8","Ariana Grande - Focus","Focus (Official Video) Download Now! http://republicrec.co/ArianaGrandeFocus Share/Stream Ariana on Spotify: ...",2015-10-30 04:01:00,2015-10-30,14460,"none","UC0VOyT2OCBKdQhF3BAbZ-1g","ArianaGrandeVevo",740582839,3909739,401756,0,0,10,"en","Música",740000
"50","1ekZEVeXwek","Ariana Grande - Into You","Into You (Official Video) Taken from the new album Dangerous Woman Download Now! http://republicrec.co/AriDangerousWoman Share/Stream more from ...",2016-05-24 04:00:00,2016-05-24,14400,"none","UC0VOyT2OCBKdQhF3BAbZ-1g","ArianaGrandeVevo",542123237,2749593,125777,0,146575,10,NA,"Música",542000
"51","dMR51c1Q5bQ","BEST OF - TOP 500 GOALS","Best Soccer Goals 2012/13 <U+25CB> Football Compilation 2014 - Die sch<f6>nsten Amateur-Tore - Besten YouTuber Freist<f6><df>e <U+25BB> Join #teamfk / Komm ins #teamfk: ...",2014-02-06 12:23:52,2014-02-06,44580,"none","UCC9h3H-sGrvqd2otknZntsQ","freekickerz",33378550,145100,6192,0,5178,17,"en","Esportes",33000
"52","zFRZfUCknUg","Best Free Kicks Montage | Vol.25 | Ronaldo vs. Messi Shots | freekickerz","Best Goal Compilation - Ronaldo CR7 Knuckleball Shots - Unsere Fu<df>ballschuh-Empfehlungen: <U+27A8> No.1: http://amzn.to/2kadvQ7 <U+27A8> No.2: http://amzn.to/2jfRDi9 ...",2013-04-19 09:39:13,2013-04-19,34740,"none","UCC9h3H-sGrvqd2otknZntsQ","freekickerz",32140779,113410,7305,0,9690,17,"en","Esportes",32000
"53","Nosf1FeO-pM","BEST OF - TOP 100 SOCCER FOOTBALL FAILS 2015","Best of TOP 100 Funny Football Moments, Youtube Free Kicks, Shots, Misses, Bloopers, Fails & Mistakes <U+25CB> Best Sport Soccer Football Fails <U+25CB> Compilation ...",2015-09-13 16:00:02,2015-09-13,57600,"none","UCC9h3H-sGrvqd2otknZntsQ","freekickerz",24385260,117611,6015,0,3164,17,"en","Esportes",24000
"54","JBuI0_BYbiM","BALOTELLI vs. REUS vs. FABREGAS - evoPOWER CHALLENGE - Part 1/2","F<e0>bregas, Reus and Balotelli Battle - Launch PUMA evoPOWER Boot - Event in Barcelona with freekickerz || Challenge PART2: http://youtu.be/JBuI0_BYbiM ...",2014-01-31 15:45:02,2014-01-31,56700,"none","UCC9h3H-sGrvqd2otknZntsQ","freekickerz",23335460,156075,5889,0,5999,17,"en","Esportes",23000
"55","ooOArqxdMuA","BEST OF - TOP 100 SOCCER FOOTBALL FAILS 2015","Ultimate Funny Soccer Moments & Fails Compilation 2015 - Best of TOP 5 Funny Football Youtube Free Kicks, Shots, Fails & Mistakes in Sport Soccer Football ...",2015-04-19 18:00:00,2015-04-19,64800,"none","UCC9h3H-sGrvqd2otknZntsQ","freekickerz",20267402,101572,4322,0,4004,17,"en","Esportes",20000
"56","ao8L-0nSYzg","Addiction","What causes addiction? Easy, right? Drugs cause addiction. But maybe it is not that simple. This video is adapted from Johann Hari's New York Times ...",2015-10-29 13:05:11,2015-10-29,47100,"none","UCsXVk37bltHxD1rDPwtNM8Q","Kurzgesagt <U+0096> In a Nutshell",14403658,358183,4793,0,20766,27,"en","Educação",14000
"57","RvOnXh3NN9w","The European Refugee Crisis and Syria Explained","Why is the refugee crisis all over the news? How is this related to Syria? Why should we care at all? Donate to the United Nations Refugee Agency: ...",2015-09-17 14:51:07,2015-09-17,53460,"none","UCsXVk37bltHxD1rDPwtNM8Q","Kurzgesagt <U+0096> In a Nutshell",11568809,188025,60531,0,59149,27,"en","Educação",11000
"58","sNhhvQGsMEc","The Fermi Paradox <U+0097> Where Are All The Aliens? (1/2)","The universe is unbelievably big <U+0096> trillions of stars and even more planets. Soo<U+0085> there just has to be life out there, right? But where is it? Why don't we see any ...",2015-05-06 12:55:55,2015-05-06,46500,"none","UCsXVk37bltHxD1rDPwtNM8Q","Kurzgesagt <U+0096> In a Nutshell",9508601,198976,2355,0,18532,27,"en","Educação",9000
"59","zQGOcOUBi6s","The Immune System Explained I <U+0096> Bacteria Infection","Every second of your life you are under attack. Bacteria, viruses, spores and more living stuff wants to enter your body and use its resources for itself.",2014-07-01 16:06:05,2014-07-01,57960,"none","UCsXVk37bltHxD1rDPwtNM8Q","Kurzgesagt <U+0096> In a Nutshell",8666859,139911,1488,0,17425,27,"en","Educação",8000
"60","4_aOIA-vyBo","Three Ways to Destroy the Universe","How will the Universe die? Everybody dies. The universe too? Well, probably. What are the current theories about the end of everything? And how creepy ...",2014-02-03 16:35:03,2014-02-03,59700,"none","UCsXVk37bltHxD1rDPwtNM8Q","Kurzgesagt <U+0096> In a Nutshell",8051349,133819,2213,0,20317,27,"en","Educação",8000
"61","ogci09kq_u4","BEST OF DAYLIGHT <U+2605> Die geile Stalking-Spr<fc>hwurst-Omi!","BEST OF DAYLIGHT <U+0095> LP: http://bit.ly/DaylightHorror <U+25BB> SAHNEH<c4>UBCHEN: http://gronkh.de?p=25785 <U+25BB> TOTAL MUTIG: http://bit.ly/BesteMenschen ...",2014-05-06 16:00:08,2014-05-06,57600,"none","UCYJ61XIK64sp6ZFFS8sctxw","Gronkh",9936556,37433,666,0,3334,20,NA,"Jogos",9000
"62","jl2xNWeujZs","GTA 5 (GTA V) [HD+] #001 - Welcome to Los Santos <U+2605> Let's Play GTA 5 (GTA V)","GTA V (GTA 5) #001 <U+0095> PLAYLIST: http://bit.ly/playGTA5 <U+25BB> GROSS DIEB AUTOS frisch auf http://gronkh.de?p=20481 <U+25BB> GANG-REKRUTIERUNG: ...",2013-09-17 01:18:51,2013-09-17,4680,"none","UCYJ61XIK64sp6ZFFS8sctxw","Gronkh",6246616,41891,2303,0,7608,20,NA,"Jogos",6000
"63","X8ZR6wAPRxM","THE AMAZING SPIDER-MAN 2 [PS4] [HD+] - Holt das Ungeziefer-Spray! <U+2605> Let's Test Spider-Man","SPIDER-MAN 2 <U+0095> PLAYLIST: Folgt. <U+25BB> Die SPINNEN doch: http://gronkh.de?p=25700 <U+25BB> SehrAMAZING: http://bit.ly/JoinGroArmy <U+00B7><U+00B7><U+00B7><U+00B7><U+00B7><U+00B7><U+00B7><U+00B7><U+00B7><U+00B7><U+00B7><U+00B7><U+00B7><U+00B7><U+00B7><U+00B7><U+00B7><U+00B7><U+00B7><U+00B7><U+00B7><U+00B7><U+00B7><U+00B7><U+00B7><U+00B7><U+00B7><U+00B7><U+00B7><U+00B7><U+00B7><U+00B7><U+00B7><U+00B7>...",2014-05-01 20:06:07,2014-05-01,72360,"none","UCYJ61XIK64sp6ZFFS8sctxw","Gronkh",5821154,26824,2606,0,3489,20,NA,"Jogos",5000
"64","Y0noFhiUh1U","Let's Test Slender [Deutsch] [HD+]","SLENDER <U+0095> Mehr HORROR: http://bit.ly/MehrHorror <U+25BB> KOSTENLOS ZIEHEN: http://gronkh.de/testet/slender <U+25BB> JUHU: http://bit.ly/JoinGroArmy <U+00B7><U+00B7><U+00B7><U+00B7><U+00B7><U+00B7><U+00B7><U+00B7><U+00B7><U+00B7><U+00B7><U+00B7><U+00B7><U+00B7><U+00B7><U+00B7><U+00B7><U+00B7><U+00B7><U+00B7><U+00B7><U+00B7><U+00B7><U+00B7><U+00B7><U+00B7>...",2012-07-21 21:41:31,2012-07-21,78060,"none","UCYJ61XIK64sp6ZFFS8sctxw","Gronkh",4006891,51145,2265,0,23311,24,NA,"Entretenimento",4000
"65","c5hlfzcVLhY","OUTLAST [HD+] #001 - Willkommen in der Anstalt <U+2605> Horror <U+2605> Let's Play Outlast","OUTLAST #001 <U+0095> AUTOPLAY: http://goo.gl/2sezWR <U+25BB> OUTGELASSEN geht es zu auf http://gronkh.de?p=20194 <U+25BB> JUHU: http://bit.ly/JoinGroArmy ...",2013-09-05 19:00:39,2013-09-05,68400,"none","UCYJ61XIK64sp6ZFFS8sctxw","Gronkh",3457446,35889,834,0,7796,20,NA,"Jogos",3000
"66","4gSOMba1UdM","Bibi H - How it is ( wap bap ... ) [Official Video]","""How it is (wap bap)"" AVAILABLE EVERYWHERE NOW: http://wmg.click/BibiH_HowItIsAY * STORES Germany: - Amazon - Media Markt - Saturn - M<fc>ller - Expert ...",2017-05-05 12:00:00,2017-05-05,43200,"none","UCHfdTAyg5t4mb1G-3rJ6QsQ","BibisBeautyPalace",46469468,390977,2576777,0,1013027,10,NA,"Música",46000
"67","HxLK4JZwUVY","10 ARTEN VON P<c4>RCHEN + Outtakes","JULIANS KANAL: https://www.youtube.com/channel/UCX71z-68tW3Pk5TW6EPKQgg Haben wir euch zum lachen bringen k<f6>nnen? DAUMEN HOCH <U+2665>. Werde ...",2013-11-10 11:00:02,2013-11-10,39600,"none","UCHfdTAyg5t4mb1G-3rJ6QsQ","BibisBeautyPalace",14578881,376224,20451,0,13505,24,NA,"Entretenimento",14000
"68","zlP7zN2obZA","10 ARTEN VON GESCHWISTERN + Outtakes","JULIANS KANAL: https://www.youtube.com/channel/UCX71z-68tW3Pk5TW6EPKQgg Konnten wir euch zum Lachen bringen? DAUMEN HOCH <U+2665>. 10 Arten von ...",2014-02-09 10:00:02,2014-02-09,36000,"none","UCHfdTAyg5t4mb1G-3rJ6QsQ","BibisBeautyPalace",12332753,274307,13192,0,13836,24,NA,"Entretenimento",12000
"69","-qe8KBevGFo","Ich PRANKE Julian // mit RIESEN STREIT :O .. meine RACHE ! BibisBeautyPalace","Jetzt hier mich kostenlos abonnieren: https://www.youtube.com/user/BibisBeautyPalace?sub_confirmation=1&feature=iv&src_vid=nGKGMX3eYxY&annotation_ ...",2016-01-21 13:00:00,2016-01-21,46800,"none","UCHfdTAyg5t4mb1G-3rJ6QsQ","BibisBeautyPalace",10266685,424244,25220,0,27262,26,NA,"Estilo de Vida",10000
"70","mjYjnjC2d7M","Ich bin schwanger :O PRANK / Ich pranke Julian .. | BibisBeautyPalace","Jetzt mich hier kostenlos abonnieren: https://www.youtube.com/user/BibisBea... Hat euch das Video gefallen? DAUMEN HOCH :). Julian prankt mich: ...",2016-05-29 09:00:02,2016-05-29,32400,"none","UCHfdTAyg5t4mb1G-3rJ6QsQ","BibisBeautyPalace",9633560,382851,35772,0,34101,26,NA,"Estilo de Vida",9000
